source_name,source_url,download_timestamp,local_file_path,file_size_bytes,status
cms_updated_renewal_outcomes_csv,https://download.medicaid.gov/data/updated-renewal-outcomes-october-2024-releasefinal.csv,2026-05-16T05:26:08.328075+00:00,data_raw/cms/updated-renewal-outcomes-october-2024-releasefinal.csv,1672639,success
data_gov_dataset_page_direct_download,https://catalog.data.gov/dataset/medicaid-and-chip-updated-renewal-outcomes,2026-05-16T05:26:08.328433+00:00,data_raw/cms/medicaid-and-chip-updated-renewal-outcomes_data_gov.html,36,direct download returned JSON Not Found in local curl; official page accessible via browser/web tool
data_gov_dataset_metadata_text,https://catalog.data.gov/dataset/medicaid-and-chip-updated-renewal-outcomes,2026-05-16T05:26:08.328632+00:00,data_raw/cms/medicaid-and-chip-updated-renewal-outcomes_data_gov_metadata.txt,723,saved metadata text from official Data.gov catalog page
cms_data_sources_definitions_pdf,https://www.medicaid.gov/resources-for-states/downloads/data-sources-and-definitions.pdf,2026-05-16T05:26:08.328831+00:00,D:\GlobalHealthPolicy Dropbox\Fan Bowei\US Insurance Project\data_raw\cms\data-sources-and-definitions.pdf,0,local download failed/empty in curl; official PDF verified accessible via browser/web tool
cms_monthly_data_reports_page,https://www.medicaid.gov/resources-for-states/coronavirus-disease-2019-covid-19/archived-unwinding-and-returning-regular-operations-after-covid-19/data-reporting/monthly-data-reports,2026-05-16T05:26:08.328862+00:00,D:\GlobalHealthPolicy Dropbox\Fan Bowei\US Insurance Project\data_raw\cms\cms_monthly_data_reports.html,0,local download failed/empty in curl; official page verified accessible via browser/web tool
